{
  "$schema": "../kirby-text.schema.json",
  "description": "Each KirbyTag gets its own KirbyTag placeholder, numbered in order of appearance.",
  "sourceText": "Visit (link: /a text: site) or (email: x@y.com text: email us)",
  "kirbyTagTypes": ["email", "link"],
  "kirbyTags": {
    "email": ["text"],
    "link": ["text"]
  },
  "translatedUnitTexts": ["Besuche <c0/> oder <c1/>", "Seite", "schreib uns"],
  "unitTexts": ["Visit <c0/> or <c1/>", "site", "email us"],
  "restoredText": "Besuche (link: /a text: Seite) oder (email: x@y.com text: schreib uns)"
}
