{
  "$schema": "../kirby-text.schema.json",
  "description": "A KirbyTag inside a parenthetical is split out; the parenthetical stays prose.",
  "sourceText": "Opening hours (Note: see (link: /hours text: hours))",
  "kirbyTagTypes": ["link"],
  "kirbyTags": {
    "link": ["text"]
  },
  "translatedUnitTexts": ["Öffnungszeiten (Hinweis: siehe <c0/>)", "Zeiten"],
  "unitTexts": ["Opening hours (Note: see <c0/>)", "hours"],
  "restoredText": "Öffnungszeiten (Hinweis: siehe (link: /hours text: Zeiten))"
}
