{
  "$schema": "../kirby-text.schema.json",
  "description": "Text without a KirbyTag is a single translation unit.",
  "sourceText": "Just some prose, nothing tagged here.",
  "kirbyTagTypes": ["link"],
  "kirbyTags": {
    "link": ["text"]
  },
  "translatedUnitTexts": ["Nur etwas Prosa, nichts getaggt."],
  "unitTexts": ["Just some prose, nothing tagged here."],
  "restoredText": "Nur etwas Prosa, nichts getaggt."
}
